<?xml version="1.0" encoding="ISO-8859-1"?>
<comments xmlns:xsi="http://www.w3.org/2001/XMLSchema-instance"
  xsi:noNamespaceSchemaLocation="schemaComments.xsd">
  <comment idParent="1641">
    <author>rhannequin</author>
    <mark>4</mark>
    <text>not terrible</text>
  </comment>
  <comment idParent="1641">
    <author>2slow</author>
    <mark>8</mark>
    <text>good</text>
  </comment>
  <comment idParent="1641">
    <author>jagbomb</author>
    <mark>9</mark>
    <text>very good</text>
  </comment>
</comments>
